{
  "schema_version": "sys4ai.plan-completion-report.v2",
  "run_id": "RUN-REPLACE-ME",
  "plan_id": "PLAN-REPLACE-ME",
  "plan_sha256": "0000000000000000000000000000000000000000000000000000000000000000",
  "repository_fingerprint": "REPOSITORY-FINGERPRINT-REPLACE-ME",
  "control_fingerprint": "CONTROL-FINGERPRINT-REPLACE-ME",
  "relay_profile": "recursive_chain_v1",
  "relay_topology": "recursive_chain_v1",
  "task_count": 1,
  "receipt_count": 1,
  "completed_task_ids": [
    "TASK-REPLACE-ME"
  ],
  "missing_task_ids": [],
  "open_intent_count": 0,
  "terminal_proof": true,
  "receipt_sha256s": [
    "0000000000000000000000000000000000000000000000000000000000000000"
  ],
  "report_content_sha256": "0000000000000000000000000000000000000000000000000000000000000000"
}
